{
  "schema_version": "0.1.0",
  "job_id": "job-weight-tracker-sample-001",
  "prd_id": "prd-weight-tracker-sample-001",
  "template_id": "flutter-open-lite",
  "prd_subject_version": "prd-weight-tracker-sample-001@0.1.0@sha256:14b8f7032e2b2b96",
  "template_subject_version": "selected-template@flutter-open-lite@v0.1.0@sha256:98b892c5043151b1",
  "planning_policy_version": "phase1-boundary-v1",
  "planning_model_snapshot": {
    "requirement_structuring": "planning_model",
    "domain_modeling": "planning_model",
    "task_allocation": "decision_model",
    "acceptance_planning": "decision_model",
    "build_input_projection": "deterministic"
  },
  "execution_route_snapshot": {
    "default_route_hint": "default_model",
    "route_hint_counts": {
      "default_model": 10,
      "deterministic": 2,
      "strong_model": 3
    },
    "task_routes": [
      {
        "allocation_id": "task-create-record-model",
        "category": "domain",
        "task_type": "dual_file_wiring",
        "route_hint": "strong_model",
        "risk_level": "high",
        "target_paths": [
          "lib/models/record.dart"
        ]
      },
      {
        "allocation_id": "task-create-summary-model",
        "category": "summary",
        "task_type": "dual_file_wiring",
        "route_hint": "strong_model",
        "risk_level": "high",
        "target_paths": [
          "lib/models/dashboard_summary.dart"
        ]
      },
      {
        "allocation_id": "task-create-repository",
        "category": "storage",
        "task_type": "dual_file_wiring",
        "route_hint": "default_model",
        "target_paths": [
          "lib/repositories/record_repository.dart"
        ]
      },
      {
        "allocation_id": "task-create-home-controller",
        "category": "summary",
        "task_type": "dual_file_wiring",
        "route_hint": "default_model",
        "target_paths": [
          "lib/controllers/home_controller.dart"
        ]
      },
      {
        "allocation_id": "task-create-form-controller",
        "category": "flow",
        "task_type": "dual_file_wiring",
        "route_hint": "default_model",
        "target_paths": [
          "lib/controllers/record_form_controller.dart"
        ]
      },
      {
        "allocation_id": "task-create-list-controller",
        "category": "flow",
        "task_type": "dual_file_wiring",
        "route_hint": "default_model",
        "target_paths": [
          "lib/controllers/record_list_controller.dart"
        ]
      },
      {
        "allocation_id": "task-create-copy",
        "category": "content",
        "task_type": "dual_file_wiring",
        "route_hint": "strong_model",
        "risk_level": "high",
        "target_paths": [
          "lib/template/open_lite_copy.dart"
        ]
      },
      {
        "allocation_id": "task-create-android-branding",
        "category": "content",
        "task_type": "dual_file_wiring",
        "route_hint": "deterministic",
        "target_paths": [
          "android/app/src/main/res/values/strings.xml"
        ]
      },
      {
        "allocation_id": "task-create-android-build-config",
        "category": "content",
        "task_type": "dual_file_wiring",
        "route_hint": "deterministic",
        "target_paths": [
          "android/app/build.gradle.kts"
        ]
      },
      {
        "allocation_id": "task-bind-overview-surface",
        "category": "screen",
        "task_type": "dual_file_wiring",
        "route_hint": "default_model",
        "target_paths": [
          "lib/views/home_page.dart"
        ]
      },
      {
        "allocation_id": "task-bind-collection-surface",
        "category": "screen",
        "task_type": "dual_file_wiring",
        "route_hint": "default_model",
        "target_paths": [
          "lib/views/record_list_page.dart"
        ]
      },
      {
        "allocation_id": "task-bind-mutation-surface",
        "category": "screen",
        "task_type": "dual_file_wiring",
        "route_hint": "default_model",
        "target_paths": [
          "lib/views/record_form_page.dart"
        ]
      },
      {
        "allocation_id": "task-bind-inspection-surface",
        "category": "screen",
        "task_type": "dual_file_wiring",
        "route_hint": "default_model",
        "target_paths": [
          "lib/views/record_detail_page.dart"
        ]
      },
      {
        "allocation_id": "task-bind-app-entry",
        "category": "screen",
        "task_type": "dual_file_wiring",
        "route_hint": "default_model",
        "target_paths": [
          "lib/main.dart"
        ]
      },
      {
        "allocation_id": "task-create-test",
        "category": "flow",
        "task_type": "dual_file_wiring",
        "route_hint": "default_model",
        "target_paths": [
          "test/widget_test.dart"
        ]
      }
    ],
    "upgrade_policy": {
      "source": "config/config.example.json:appfactory.builder_runtime.upgrade_threshold",
      "max_attempts_before_upgrade": 2,
      "max_files_before_upgrade": 2,
      "max_schema_drift_before_upgrade": 1,
      "max_unrelated_operation_rate": 0.4,
      "upgrade_on_validation_fail": true,
      "upgrade_on_patch_parse_fail": true,
      "upgrade_on_scope_violation": true,
      "upgrade_on_semantic_conflict": true,
      "supported_retry_upgrade_signals": [
        "parse_failure",
        "schema_drift",
        "unrelated_edits",
        "scope_violation",
        "validation_failure",
        "semantic_conflict"
      ]
    },
    "start_upgrade_check": {
      "current_attempt": 1,
      "concrete_target_file_count": 15,
      "would_upgrade_from_start": true,
      "triggered_reasons": [
        "max_files_before_upgrade"
      ]
    },
    "allowed_paths": [
      "lib/**",
      "assets/**",
      "pubspec.yaml",
      "test/**",
      "android/app/build.gradle.kts",
      "android/app/src/main/res/values/strings.xml"
    ],
    "protected_paths": [
      "android/app/src/main/AndroidManifest.xml",
      "android/app/src/main/kotlin/**",
      "android/gradle/**",
      "android/local.properties",
      "ios/**",
      "linux/**",
      "macos/**",
      "windows/**"
    ],
    "command_profile_ref": "flutter-builder-p0"
  },
  "planning_policy": {
    "policy_version": "phase1-boundary-v1",
    "stages": [
      {
        "stage": "requirement_structuring",
        "route": "planning_model",
        "rationale": "需求整理允许强模型参与，但输出必须收敛到受控 PRD 结构。"
      },
      {
        "stage": "domain_modeling",
        "route": "planning_model",
        "rationale": "领域对象抽取属于高不确定性语义建模，默认走 planning_model。"
      },
      {
        "stage": "task_allocation",
        "route": "decision_model",
        "rationale": "任务拆解、依赖裁决和 route hint 分配默认走 decision_model。"
      },
      {
        "stage": "acceptance_planning",
        "route": "decision_model",
        "rationale": "验收边界与冲突消解属于裁决层，不交给自由执行层。"
      },
      {
        "stage": "build_input_projection",
        "route": "deterministic",
        "rationale": "builder-input 只是运行时投影包，默认禁止自由生成模型参与。"
      }
    ]
  },
  "human_notes": [
    {
      "note_id": "note-weight-domain",
      "scope": "engineering",
      "summary": "Builder 后续必须把中性 record 骨架收口为体重记录 app，而不是停在 open-lite 默认文案。"
    },
    {
      "note_id": "note-weight-summary",
      "scope": "product",
      "summary": "首页摘要必须承接最新体重、记录数量和趋势，不允许只保留通用计数。"
    }
  ],
  "manual_constraints": [
    "当前体重记录模板默认本地优先，不接入登录、云同步、图表分享和社区能力。",
    "模板当前仍复用 open-lite 中性交互承载骨架，但不能牺牲体重、日期、备注与趋势等核心语义。",
    "当前阶段仍以稳定 Builder 输入包和多页面 seed 为主，不把远端 API 作为默认前提。",
    "需求拆解后二开应优先复用概览、历史集合、实体变更、结果检查四类承载单元，而不是新增第二套平行骨架。"
  ],
  "requirement_highlights": [
    "目标是离线使用的个人健康记录工具。",
    "概览承载单元需要展示最近趋势和记录数量。",
    "实体变更承载单元需要录入体重、日期和备注。",
    "历史集合与结果检查入口需要查看历史体重记录。"
  ],
  "supporting_assumptions": [
    "默认离线单机运行。",
    "模板服务单一核心任务闭环。",
    "本地持久化是当前默认数据源。"
  ]
}
